[
 {
  "id": "event_envoy_trust",
  "requires_all": [
   "approach_diplomatic"
  ],
  "requires_any_prefix": null,
  "requires_ending_ready": false
 },
 {
  "id": "event_prologue_landing",
  "requires_all": [],
  "requires_any_prefix": null,
  "requires_ending_ready": false
 },
 {
  "id": "event_first_mining",
  "requires_all": [
   "first_mining_done"
  ],
  "requires_any_prefix": null,
  "requires_ending_ready": false
 },
 {
  "id": "event_drift_aftermath",
  "requires_all": [
   "encounter_first_drift_won"
  ],
  "requires_any_prefix": null,
  "requires_ending_ready": false
 },
 {
  "id": "event_first_anchor",
  "requires_all": [
   "first_anchor_placed"
  ],
  "requires_any_prefix": null,
  "requires_ending_ready": false
 },
 {
  "id": "event_workshop_guide",
  "requires_all": [
   "anchor_workshop_placed"
  ],
  "requires_any_prefix": null,
  "requires_ending_ready": false
 },
 {
  "id": "event_misa_campfire",
  "requires_all": [
   "anchor_workshop_placed"
  ],
  "requires_any_prefix": null,
  "requires_ending_ready": false
 },
 {
  "id": "event_husk_aftermath",
  "requires_all": [
   "encounter_husk_ambush_won"
  ],
  "requires_any_prefix": null,
  "requires_ending_ready": false
 },
 {
  "id": "event_station_mode",
  "requires_all": [
   "echo_chamber_active"
  ],
  "requires_any_prefix": null,
  "requires_ending_ready": false
 },
 {
  "id": "event_echo_resonance",
  "requires_all": [
   "echo_chamber_active"
  ],
  "requires_any_prefix": null,
  "requires_ending_ready": false
 },
 {
  "id": "event_approach",
  "requires_all": [],
  "requires_any_prefix": "station_mode_",
  "requires_ending_ready": false
 },
 {
  "id": "event_policy",
  "requires_all": [],
  "requires_any_prefix": "approach_",
  "requires_ending_ready": false
 },
 {
  "id": "event_lumen_wildfire",
  "requires_all": [
   "world_response_exploited"
  ],
  "requires_any_prefix": null,
  "requires_ending_ready": false
 },
 {
  "id": "event_diplomat_envoy",
  "requires_all": [
   "diplomatic_stance",
   "echo_chamber_active"
  ],
  "requires_any_prefix": null,
  "requires_ending_ready": false
 },
 {
  "id": "event_leviathan_pact_pre",
  "requires_all": [
   "mine_entered",
   "encounter_leviathan_due"
  ],
  "requires_any_prefix": null,
  "requires_ending_ready": false
 },
 {
  "id": "event_leviathan_pact",
  "requires_all": [
   "encounter_leviathan_due"
  ],
  "requires_any_prefix": null,
  "requires_ending_ready": false
 },
 {
  "id": "event_leviathan_aftermath",
  "requires_all": [
   "encounter_leviathan_won"
  ],
  "requires_any_prefix": null,
  "requires_ending_ready": false
 },
 {
  "id": "event_dust_calamity",
  "requires_all": [
   "anchor_workshop_placed"
  ],
  "requires_any_prefix": null,
  "requires_ending_ready": false
 },
 {
  "id": "event_quiet_night",
  "requires_all": [
   "event_event_misa_campfire_done",
   "anchor_workshop_placed"
  ],
  "requires_any_prefix": null,
  "requires_ending_ready": false
 },
 {
  "id": "event_pylon_hum",
  "requires_all": [
   "pylon_stabilized"
  ],
  "requires_any_prefix": null,
  "requires_ending_ready": false
 },
 {
  "id": "event_final_ascent",
  "requires_all": [
   "encounter_leviathan_won",
   "encounter_leviathan_due"
  ],
  "requires_any_prefix": null,
  "requires_ending_ready": false
 },
 {
  "id": "event_ending_luoxian",
  "requires_all": [],
  "requires_any_prefix": null,
  "requires_ending_ready": true
 },
 {
  "id": "event_ending_misa",
  "requires_all": [],
  "requires_any_prefix": null,
  "requires_ending_ready": true
 },
 {
  "id": "event_epilogue_exploited",
  "requires_all": [
   "station_mode_exploit",
   "world_response_exploited",
   "encounter_leviathan_won"
  ],
  "requires_any_prefix": null,
  "requires_ending_ready": false
 },
 {
  "id": "event_epilogue_sealed",
  "requires_all": [
   "station_mode_seal",
   "echo_chamber_active",
   "encounter_leviathan_won"
  ],
  "requires_any_prefix": null,
  "requires_ending_ready": false
 },
 {
  "id": "event_epilogue_symbiosis",
  "requires_all": [
   "station_mode_symbiosis",
   "echo_chamber_active",
   "encounter_leviathan_won"
  ],
  "requires_any_prefix": null,
  "requires_ending_ready": false
 }
]
